{
  "$schema": "./runtime-lock.schema.json",
  "schemaVersion": 1,
  "status": "verified",
  "runtimeAbi": "drowse-web-runtime-v1",
  "hookAbi": "post-block-residual-v4",
  "exactReadoutAbi": "exact-readout-v1",
  "toolchain": {
    "forkManifestSha256": "555070721b5123dc987aec596f55cc9767824f17e71ca135df040654de694fec",
    "mlcLlmFork": {
      "repository": "https://github.com/a9lim/mlc-llm-polythetic",
      "commit": null
    },
    "webLlmFork": {
      "repository": "https://github.com/a9lim/web-llm-polythetic",
      "commit": null
    },
    "webLlmPackage": {
      "path": "browser-runtime/vendor/drowse-web-llm-0.2.84-drowse.40.tgz",
      "sha256": "e867b86a62d9277f536e2a3d435aa29bb39b0ff89c75e32249b3d7eed9932e6c",
      "name": "@drowse/web-llm",
      "version": "0.2.84-drowse.40",
      "repository": "https://github.com/a9lim/web-llm-polythetic",
      "sourceCommit": null
    },
    "tvmRepository": "https://github.com/apache/tvm.git",
    "tvmCommit": "68ba2b31c2a6d202fcd44e5780ef10ce08721dd5",
    "tvmFfiCommit": "12dbf053b3d9ba4ebd9da3123b1aeca79cf74229",
    "emsdkCommit": "e10826f9196bb0e704014af2252ef58fb4ba261b",
    "emccVersion": "3.1.56",
    "emccRevision": "cf90417346b78455089e64eb909d71d091ecc055",
    "emccPlatform": "linux/amd64",
    "llvmVersion": "18.1.8",
    "llvmArtifacts": [
      {
        "platform": "linux/amd64",
        "archive": "clang+llvm-18.1.8-x86_64-linux-gnu-ubuntu-18.04.tar.xz",
        "sha256": "54ec30358afcc9fb8aa74307db3046f5187f9fb89fb37064cdde906e062ebf36"
      },
      {
        "platform": "linux/arm64",
        "archive": "clang+llvm-18.1.8-aarch64-linux-gnu.tar.xz",
        "sha256": "dcaa1bebbfbb86953fdfbdc7f938800229f75ad26c5c9375ef242edad737d999"
      }
    ],
    "compilerImage": {
      "reference": null,
      "digest": null,
      "recipeSha256": "57c1817ff56248c6615b5854940fd00e447e5843198ffd9990aee3c9d95adcb8"
    }
  },
  "models": [
    {
      "id": "gemma3-270m-instruct",
      "architecture": "gemma3_text",
      "structuredHookProfile": "standard-v3",
      "thinkingProfile": null,
      "sourceRepository": "unsloth/gemma-3-270m-it",
      "sourceRevision": "23cf460f6bb16954176b3ddcc8d4f250501458a9",
      "convertedRepository": "logitsml/drowse-web-gemma3-270m",
      "convertedRevision": "3e1d604dbc4d6587f0df8bb09f021f1eff6aec8c",
      "manifestSha256": "f5fa544c45399f5551ea4f01010540036bfa02b51487bcc50094c36426fb4586",
      "librarySha256": "4ae2284dab2453d23971bd3081683f90bbc57b742360cf5cdb8dace9abfcd780",
      "tokenizerSha256": "4667f2089529e8e7657cfb6d1c19910ae71ff5f28aa7ab2ff2763330affad795",
      "chatTemplateSha256": "be2182df1ad0ea735d336418896eb06e5cc2f59136e7aaeac5de2ec2197742ac",
      "hiddenSize": 640,
      "layerMap": [
        0,
        1,
        2,
        3,
        4,
        5,
        6,
        7,
        8,
        9,
        10,
        11,
        12,
        13,
        14,
        15,
        16,
        17
      ],
      "quantization": "q0f32",
      "contextProfiles": [
        2048,
        4096
      ]
    },
    {
      "id": "gemma3-1b-instruct",
      "architecture": "gemma3_text",
      "structuredHookProfile": "standard-v3",
      "thinkingProfile": null,
      "sourceRepository": "unsloth/gemma-3-1b-it",
      "sourceRevision": "5b11413a10db4e486ef16a20101fd028f8f2499c",
      "convertedRepository": "logitsml/drowse-web-gemma3-1b",
      "convertedRevision": "4891d37fe4f26a16e246134e51ec5dcef2f1121e",
      "manifestSha256": "40ef8d47203ef0f1e768b819cd84bc60a146a97d63cb4883d3563cbacbdc9df4",
      "librarySha256": "83ba8e0a9bd86e9d62437e8d7b51125ae48be42dcde7c0f8283f8819d6ed73f2",
      "tokenizerSha256": "4667f2089529e8e7657cfb6d1c19910ae71ff5f28aa7ab2ff2763330affad795",
      "chatTemplateSha256": "a622f3103725cffe1f19deed01e8675cea4443bc3eff27680f9484e5dc4acf7b",
      "hiddenSize": 1152,
      "layerMap": [
        0,
        1,
        2,
        3,
        4,
        5,
        6,
        7,
        8,
        9,
        10,
        11,
        12,
        13,
        14,
        15,
        16,
        17,
        18,
        19,
        20,
        21,
        22,
        23,
        24,
        25
      ],
      "quantization": "q4f32_1",
      "contextProfiles": [
        2048,
        4096
      ]
    },
    {
      "id": "gemma3-4b-instruct",
      "architecture": "gemma3_text",
      "structuredHookProfile": "standard-v3",
      "thinkingProfile": null,
      "sourceRepository": "unsloth/gemma-3-4b-it",
      "sourceRevision": "bf46152c47f5dd20b896357cb51abc4c03b8ee8c",
      "convertedRepository": "logitsml/drowse-web-gemma3-4b",
      "convertedRevision": "a4186633865c32c001321c7f59119c2242cda21e",
      "manifestSha256": "f19b31f7138a587ff9bebe2c39527c7eae829ff8bbcd56db1d1ae0913ac159a0",
      "librarySha256": "7937326b8429e01e5e39354c7f4fcf57eec3843f0e7297c32ae655888c3e623b",
      "tokenizerSha256": "4667f2089529e8e7657cfb6d1c19910ae71ff5f28aa7ab2ff2763330affad795",
      "chatTemplateSha256": "8925eabb556c1897ca1bed405f0612e735a56afcd4d77e76eb90fd771e706f9c",
      "hiddenSize": 2560,
      "layerMap": [
        0,
        1,
        2,
        3,
        4,
        5,
        6,
        7,
        8,
        9,
        10,
        11,
        12,
        13,
        14,
        15,
        16,
        17,
        18,
        19,
        20,
        21,
        22,
        23,
        24,
        25,
        26,
        27,
        28,
        29,
        30,
        31,
        32,
        33
      ],
      "quantization": "q4f32_1",
      "contextProfiles": [
        2048,
        4096
      ]
    },
    {
      "id": "qwen3-4b",
      "architecture": "qwen3",
      "structuredHookProfile": "standard-v3",
      "thinkingProfile": {
        "start": "<think>",
        "end": "</think>",
        "startsInThinking": false,
        "startTokenIds": [
          151667
        ],
        "endTokenIds": [
          151668
        ]
      },
      "sourceRepository": "Qwen/Qwen3-4B",
      "sourceRevision": "1cfa9a7208912126459214e8b04321603b3df60c",
      "convertedRepository": "logitsml/drowse-web-qwen3-4b",
      "convertedRevision": "7af57a07cb2ff2f4245ad8617fb204a1144906b3",
      "manifestSha256": "b19c107ebd7d637bd89dad4882e7972dd7a81ab04f2ce1960bc1dfc1dd266204",
      "librarySha256": "94993fd70d3090f73a2bdb52f064c5d5008420fde0ef53a556a1dbf65feaeea5",
      "tokenizerSha256": "aeb13307a71acd8fe81861d94ad54ab689df773318809eed3cbe794b4492dae4",
      "chatTemplateSha256": "d5d09f07b48c3086c508b30d1c9114bd1189145b74e982a265350c923acd8101",
      "hiddenSize": 2560,
      "layerMap": [
        0,
        1,
        2,
        3,
        4,
        5,
        6,
        7,
        8,
        9,
        10,
        11,
        12,
        13,
        14,
        15,
        16,
        17,
        18,
        19,
        20,
        21,
        22,
        23,
        24,
        25,
        26,
        27,
        28,
        29,
        30,
        31,
        32,
        33,
        34,
        35
      ],
      "quantization": "q4f32_1",
      "contextProfiles": [
        2048,
        4096
      ]
    },
    {
      "id": "qwen3-1.7b",
      "architecture": "qwen3",
      "structuredHookProfile": "standard-v3",
      "thinkingProfile": {
        "start": "<think>",
        "end": "</think>",
        "startsInThinking": false,
        "startTokenIds": [
          151667
        ],
        "endTokenIds": [
          151668
        ]
      },
      "sourceRepository": "Qwen/Qwen3-1.7B",
      "sourceRevision": "70d244cc86ccca08cf5af4e1e306ecf908b1ad5e",
      "convertedRepository": "logitsml/drowse-web-qwen3-1.7b",
      "convertedRevision": "6ce859176cf7d69f59f7cee2fe7d5ddb9b6fdff6",
      "manifestSha256": "8eab009068b10b93d819c14dff5c04c3866feb690d5a981d163eb8eee64ff956",
      "librarySha256": "e0e5b4b0c33f4df380b925167c61ca2f8ca0e67967488ab791d1adb64b8cd362",
      "tokenizerSha256": "aeb13307a71acd8fe81861d94ad54ab689df773318809eed3cbe794b4492dae4",
      "chatTemplateSha256": "d5d09f07b48c3086c508b30d1c9114bd1189145b74e982a265350c923acd8101",
      "hiddenSize": 2048,
      "layerMap": [
        0,
        1,
        2,
        3,
        4,
        5,
        6,
        7,
        8,
        9,
        10,
        11,
        12,
        13,
        14,
        15,
        16,
        17,
        18,
        19,
        20,
        21,
        22,
        23,
        24,
        25,
        26,
        27
      ],
      "quantization": "q4f32_1",
      "contextProfiles": [
        2048,
        4096
      ]
    },
    {
      "id": "gpt2-base",
      "modelType": "base",
      "architecture": "gpt2",
      "structuredHookProfile": "standard-v3",
      "thinkingProfile": null,
      "sourceRepository": "openai-community/gpt2",
      "sourceRevision": "607a30d783dfa663caf39e06633721c8d4cfcd7e",
      "convertedRepository": "logitsml/drowse-web-gpt2-base",
      "convertedRevision": "787a18eed89e1c5e342382c6b88fb5f4dcd5f978",
      "manifestSha256": "571e5c3a42148b976ceb2b714408cf48589d6fc2d71ff20101586577773124d5",
      "librarySha256": "858a656f68972067a27d8d702dbec641300b3fff266f0be96c519f05ba1bda48",
      "tokenizerSha256": "8414cab924d8b9b33013f0d221c5862f365ee9be39c5c2bfae8a5a9e970478a6",
      "chatTemplateSha256": "5e04eb606e3a1583530a42e36c2a6b6615c86f34fe77e44d9ddeb43ff940931f",
      "hiddenSize": 768,
      "layerMap": [
        0,
        1,
        2,
        3,
        4,
        5,
        6,
        7,
        8,
        9,
        10,
        11
      ],
      "quantization": "q0f32",
      "contextProfiles": [
        1024
      ]
    },
    {
      "id": "pythia-70m-base",
      "modelType": "base",
      "architecture": "gpt_neox",
      "structuredHookProfile": "standard-v3",
      "thinkingProfile": null,
      "sourceRepository": "EleutherAI/pythia-70m-deduped",
      "sourceRevision": "e93a9faa9c77e5d09219f6c868bfc7a1bd65593c",